{
  "$schema": "https://json-schema.org/draft/2020-12/schema",
  "$id": "https://example.invalid/vietnam-basemap/manifest.schema.json",
  "title": "Vietnam Basemap Release Manifest",
  "type": "object",
  "additionalProperties": false,
  "required": [
    "id",
    "name",
    "version",
    "contractVersion",
    "schemaVersion",
    "language",
    "projection",
    "tileFormat",
    "container",
    "minZoom",
    "maxZoom",
    "defaultStyle",
    "coverage",
    "sources",
    "styles",
    "assets",
    "attribution",
    "generatedAt"
  ],
  "properties": {
    "id": { "type": "string", "minLength": 1 },
    "name": { "type": "string", "minLength": 1 },
    "version": { "type": "string", "minLength": 1 },
    "contractVersion": { "type": "string", "const": "1" },
    "schemaVersion": { "type": "string", "const": "1" },
    "language": { "type": "string", "minLength": 1 },
    "projection": { "type": "string", "minLength": 1 },
    "tileFormat": { "type": "string", "minLength": 1 },
    "container": { "type": "string", "minLength": 1 },
    "minZoom": { "type": "integer", "minimum": 0 },
    "maxZoom": { "type": "integer", "minimum": 0 },
    "defaultStyle": { "type": "string", "minLength": 1 },
    "coverage": { "$ref": "#/$defs/coverage" },
    "sources": {
      "type": "array",
      "minItems": 1,
      "items": { "$ref": "#/$defs/source" }
    },
    "styles": {
      "type": "array",
      "minItems": 1,
      "items": { "$ref": "#/$defs/style" }
    },
    "assets": { "$ref": "#/$defs/assets" },
    "attribution": { "type": "string", "minLength": 1 },
    "generatedAt": { "type": "string", "minLength": 1 }
  },
  "$defs": {
    "bbox": {
      "type": "object",
      "additionalProperties": false,
      "required": ["west", "south", "east", "north"],
      "properties": {
        "west": { "type": "number" },
        "south": { "type": "number" },
        "east": { "type": "number" },
        "north": { "type": "number" }
      }
    },
    "coverage": {
      "type": "object",
      "additionalProperties": false,
      "required": ["region", "buffered", "bbox"],
      "properties": {
        "region": { "type": "string", "minLength": 1 },
        "buffered": { "type": "boolean" },
        "bbox": { "$ref": "#/$defs/bbox" }
      }
    },
    "source": {
      "type": "object",
      "additionalProperties": false,
      "required": ["id", "name", "version", "license", "attribution"],
      "properties": {
        "id": { "type": "string", "minLength": 1 },
        "name": { "type": "string", "minLength": 1 },
        "version": { "type": "string", "minLength": 1 },
        "license": { "type": "string", "minLength": 1 },
        "attribution": { "type": "string", "minLength": 1 },
        "uri": { "type": "string" }
      }
    },
    "style": {
      "type": "object",
      "additionalProperties": false,
      "required": ["id", "label", "path"],
      "properties": {
        "id": { "type": "string", "minLength": 1 },
        "label": { "type": "string", "minLength": 1 },
        "path": { "type": "string", "minLength": 1 }
      }
    },
    "assets": {
      "type": "object",
      "additionalProperties": false,
      "required": ["tileArchive", "fonts", "sprites"],
      "properties": {
        "tileArchive": { "type": "string", "minLength": 1 },
        "fonts": {
          "type": "array",
          "minItems": 1,
          "items": { "type": "string", "minLength": 1 }
        },
        "sprites": {
          "type": "array",
          "minItems": 1,
          "items": { "type": "string", "minLength": 1 }
        },
        "streetViewCoverage": {
          "type": "string",
          "minLength": 1
        }
      }
    }
  }
}
