{
  "id": "vn-basemap",
  "name": "Vietnam Basemap",
  "version": "1.0.0",
  "contractVersion": "1",
  "schemaVersion": "1",
  "language": "vi",
  "projection": "EPSG:3857",
  "tileFormat": "mvt",
  "container": "pmtiles",
  "minZoom": 0,
  "maxZoom": 18,
  "defaultStyle": "engineering",
  "coverage": {
    "region": "VN",
    "buffered": true,
    "bbox": {
      "west": 101.5,
      "south": 7.5,
      "east": 110.5,
      "north": 23.8
    }
  },
  "sources": [
    {
      "id": "osm",
      "name": "OpenStreetMap Vietnam",
      "version": "2026-08-11",
      "license": "ODbL",
      "attribution": "© OpenStreetMap contributors",
      "uri": "https://www.openstreetmap.org/"
    },
    {
      "id": "supplemental-open-data",
      "name": "Supplemental open data",
      "version": "example-1",
      "license": "operator-declared",
      "attribution": "Supplemental source attribution"
    }
  ],
  "styles": [
    { "id": "light", "label": "Light", "path": "styles/light.json" },
    { "id": "dark", "label": "Dark", "path": "styles/dark.json" },
    { "id": "engineering", "label": "Engineering", "path": "styles/engineering.json" }
  ],
  "assets": {
    "tileArchive": "tiles/vietnam.pmtiles",
    "fonts": ["fonts/Noto Sans/0-255.pbf"],
    "sprites": ["sprites/basemap.json", "sprites/basemap.png"]
  },
  "attribution": "© OpenStreetMap contributors",
  "generatedAt": "2026-08-11T00:00:00Z"
}
